{
  "schema_version": "external_hair_dataset_manifest_v0.1",
  "dataset_id": "external_hair_dataset_pilot_v0",
  "generated_at": "2026-05-28T00:00:00+08:00",
  "project_guards": {
    "v8_immutable": true,
    "replace_in_beauty_glb": false,
    "external_asset_usage": "prior_only",
    "large_binaries_committed": false,
    "cloth_seam_surface_blocked": true
  },
  "sources": [
    {
      "source_id": "opengameart_ponytail_female",
      "source_url": "https://opengameart.org/content/ponytail-hair-style-for-female-model",
      "source_name": "OpenGameArt Ponytail hair style for female model",
      "claimed_license": "CC0",
      "license_confidence": "high",
      "possible_usage_role": "Ponytail/scalp anchor and low-poly clump prior.",
      "can_commit_binary_to_repo": "yes_after_license_snapshot",
      "can_commit_renders": "yes",
      "can_extract_curve_templates": "yes_from_mesh_centerlines",
      "recommendation": "open_template_source",
      "intake_status": "source_identified_metadata_only",
      "external_asset_usage": "prior_only",
      "replace_in_beauty_glb": false,
      "download_status": "not_downloaded",
      "validation_status": {"status": "skipped", "skipped_with_reason": "metadata_pilot_no_binary_download"},
      "notes": ["Small CC0 mesh source; intake still requires license snapshot and checksum before any binary commit."]
    },
    {
      "source_id": "opengameart_long_male",
      "source_url": "https://opengameart.org/content/long-hairstyle-for-male-model",
      "source_name": "OpenGameArt Long hairstyle for male model",
      "claimed_license": "CC0",
      "license_confidence": "high",
      "possible_usage_role": "Long flat-hair silhouette and strip-like low-poly prior.",
      "can_commit_binary_to_repo": "yes_after_license_snapshot",
      "can_commit_renders": "yes",
      "can_extract_curve_templates": "yes_from_mesh_centerlines",
      "recommendation": "open_template_source",
      "intake_status": "source_identified_metadata_only",
      "external_asset_usage": "prior_only",
      "replace_in_beauty_glb": false,
      "download_status": "not_downloaded",
      "validation_status": {"status": "skipped", "skipped_with_reason": "metadata_pilot_no_binary_download"},
      "notes": ["Potential strip/ribbon width prior; not YUNA replacement geometry."]
    },
    {
      "source_id": "opengameart_upcomb_male",
      "source_url": "https://opengameart.org/content/upcomb-hair-style-for-male-model",
      "source_name": "OpenGameArt Upcomb hair style for male model",
      "claimed_license": "CC0",
      "license_confidence": "high",
      "possible_usage_role": "Compact scalp-hugging topology prior.",
      "can_commit_binary_to_repo": "yes_after_license_snapshot",
      "can_commit_renders": "yes",
      "can_extract_curve_templates": "limited_short_hair",
      "recommendation": "open_template_source",
      "intake_status": "source_identified_metadata_only",
      "external_asset_usage": "prior_only",
      "replace_in_beauty_glb": false,
      "download_status": "not_downloaded",
      "validation_status": {"status": "skipped", "skipped_with_reason": "metadata_pilot_no_binary_download"},
      "notes": ["Lower priority for YUNA long hair, but useful as negative/compact clump example."]
    },
    {
      "source_id": "opengameart_hair_alphas_for_days",
      "source_url": "https://opengameart.org/content/hair-alphas-for-days",
      "source_name": "OpenGameArt Hair Alphas For Days",
      "claimed_license": "CC0",
      "license_confidence": "high",
      "possible_usage_role": "Hair-card alpha material fixture source.",
      "can_commit_binary_to_repo": "partial_selected_small_files_only",
      "can_commit_renders": "yes",
      "can_extract_curve_templates": "no_texture_only",
      "recommendation": "open_template_source",
      "intake_status": "source_identified_metadata_only",
      "external_asset_usage": "prior_only",
      "replace_in_beauty_glb": false,
      "download_status": "not_downloaded",
      "validation_status": {"status": "skipped", "skipped_with_reason": "bulk_archive_not_downloaded_in_metadata_pilot"},
      "notes": ["Do not commit the bulk archive; future intake may select small individual PNGs after license snapshot."]
    },
    {
      "source_id": "opengameart_vroid_cc0_samples",
      "source_url": "https://opengameart.org/content/vroid-studio-cc0-models",
      "source_name": "OpenGameArt / VRoid Studio CC0 models and hair samples",
      "claimed_license": "CC0 for explicitly listed hair samples",
      "license_confidence": "high",
      "possible_usage_role": "Anime/stylized hair topology and VRM import reference.",
      "can_commit_binary_to_repo": "yes_selected_cc0_files_after_review",
      "can_commit_renders": "yes_selected_cc0_files",
      "can_extract_curve_templates": "yes_after_import_verification",
      "recommendation": "open_template_source",
      "intake_status": "source_identified_metadata_only",
      "external_asset_usage": "prior_only",
      "replace_in_beauty_glb": false,
      "download_status": "not_downloaded",
      "validation_status": {"status": "skipped", "skipped_with_reason": "metadata_pilot_no_binary_download"},
      "notes": ["Do not include restricted AvatarSample files; future intake must isolate HairSample files only."]
    },
    {
      "source_id": "blendswap_hair_factory",
      "source_url": "https://blendswap.com/blend/5913",
      "source_name": "Blend Swap Hair Factory v1.0",
      "claimed_license": "CC0",
      "license_confidence": "high",
      "possible_usage_role": "Low-poly hair workflow and card/tooling reference.",
      "can_commit_binary_to_repo": "yes_after_license_snapshot",
      "can_commit_renders": "yes",
      "can_extract_curve_templates": "yes_workflow_reference",
      "recommendation": "open_template_source",
      "intake_status": "source_identified_metadata_only",
      "external_asset_usage": "prior_only",
      "replace_in_beauty_glb": false,
      "download_status": "not_downloaded",
      "validation_status": {"status": "skipped", "skipped_with_reason": "metadata_pilot_no_binary_download"},
      "notes": ["Approximate 15 MB source should be deferred until its value is proven."]
    },
    {
      "source_id": "blendswap_curly_hair",
      "source_url": "https://blendswap.com/blend/24481",
      "source_name": "Blend Swap Curly Hair",
      "claimed_license": "CC0",
      "license_confidence": "high",
      "possible_usage_role": "Bezier-curve curl template prior.",
      "can_commit_binary_to_repo": "yes_after_license_snapshot",
      "can_commit_renders": "yes",
      "can_extract_curve_templates": "yes_curve_templates",
      "recommendation": "open_template_source",
      "intake_status": "source_identified_metadata_only",
      "external_asset_usage": "prior_only",
      "replace_in_beauty_glb": false,
      "download_status": "not_downloaded",
      "validation_status": {"status": "skipped", "skipped_with_reason": "metadata_pilot_no_binary_download"},
      "notes": ["Strong curve-template candidate after local license snapshot and checksum."]
    },
    {
      "source_id": "blendswap_braided_hair",
      "source_url": "https://blendswap.com/blend/18823",
      "source_name": "Blend Swap Braided Hair",
      "claimed_license": "CC0",
      "license_confidence": "high",
      "possible_usage_role": "Braid topology and repeated interleaved strand prior.",
      "can_commit_binary_to_repo": "yes_after_license_snapshot",
      "can_commit_renders": "yes",
      "can_extract_curve_templates": "yes_from_mesh_or_modifiers",
      "recommendation": "open_template_source",
      "intake_status": "source_identified_metadata_only",
      "external_asset_usage": "prior_only",
      "replace_in_beauty_glb": false,
      "download_status": "not_downloaded",
      "validation_status": {"status": "skipped", "skipped_with_reason": "metadata_pilot_no_binary_download"},
      "notes": ["Useful for topology pattern study, not direct shape transfer."]
    },
    {
      "source_id": "blendswap_dynamic_hairstyle_1",
      "source_url": "https://blendswap.com/blend/22778",
      "source_name": "Blend Swap Dynamic Hairstyle Model (1 / 10)",
      "claimed_license": "CC-0 claimed",
      "license_confidence": "medium",
      "possible_usage_role": "Dynamic curve hair study after paid-pack context is resolved.",
      "can_commit_binary_to_repo": "pending_paid_pack_context",
      "can_commit_renders": "pending",
      "can_extract_curve_templates": "pending",
      "recommendation": "pending",
      "intake_status": "license_review_pending",
      "external_asset_usage": "prior_only",
      "replace_in_beauty_glb": false,
      "download_status": "not_downloaded",
      "validation_status": {"status": "skipped", "skipped_with_reason": "license_context_pending"},
      "notes": ["Do not download or derive until the single free asset license is separated from paid pack context."]
    },
    {
      "source_id": "open3dlab_hair_cards_to_curves",
      "source_url": "https://open3dlab.com/project/97f61186-8e4f-4513-9986-7dc0d51b6983/",
      "source_name": "Open3DLab Hair Cards to Curves Tool",
      "claimed_license": "CC0 1.0 claimed by uploader",
      "license_confidence": "medium-low",
      "possible_usage_role": "Local method study for card-to-curve conversion.",
      "can_commit_binary_to_repo": "no_uploader_license_unverified",
      "can_commit_renders": "local_internal_only",
      "can_extract_curve_templates": "local_study_only",
      "recommendation": "local_study_only",
      "intake_status": "local_study_metadata_recorded",
      "external_asset_usage": "prior_only",
      "replace_in_beauty_glb": false,
      "download_status": "not_downloaded",
      "validation_status": {"status": "skipped", "skipped_with_reason": "uploader_license_unverified"},